{
  "$schema": "http://json-schema.org/draft-07/schema#",
  "title": "xref agent-mode output envelope",
  "description": "Stable agent-mode JSON envelope produced by `xref --json`. All RTLScanner subcommands share the same top-level shape.",
  "type": "object",
  "required": [
    "tool",
    "version",
    "status",
    "command",
    "data",
    "diagnostics",
    "errors",
    "summary"
  ],
  "properties": {
    "tool": {
      "type": "string",
      "const": "xref"
    },
    "version": {
      "type": "string"
    },
    "status": {
      "type": "string",
      "enum": [
        "ok",
        "error"
      ]
    },
    "command": {
      "type": "object",
      "description": "Echo of the parsed argparse Namespace minus output flags."
    },
    "data": {
      "oneOf": [
        {
          "type": "object",
          "required": [
            "mode"
          ],
          "properties": {
            "mode": {
              "type": "string",
              "const": "xref"
            },
            "target": {
              "type": "object"
            },
            "scope": {
              "type": "string"
            },
            "name": {
              "type": "string"
            },
            "recursive": {
              "type": "boolean"
            },
            "matches": {
              "type": "array",
              "items": {
                "type": "object",
                "required": [
                  "symbol",
                  "definitions",
                  "references",
                  "summary"
                ],
                "properties": {
                  "symbol": {
                    "type": "object",
                    "required": [
                      "name",
                      "kind",
                      "type",
                      "hierarchical_path",
                      "lexical_path"
                    ],
                    "properties": {
                      "name": {
                        "type": "string"
                      },
                      "kind": {
                        "type": "string"
                      },
                      "type": {
                        "type": "string"
                      },
                      "direction": {
                        "type": "string"
                      },
                      "hierarchical_path": {
                        "type": "string"
                      },
                      "lexical_path": {
                        "type": "string"
                      },
                      "file": {
                        "type": "string"
                      },
                      "line": {
                        "type": "integer"
                      },
                      "column": {
                        "type": "integer"
                      },
                      "location": {
                        "type": "object",
                        "required": [
                          "file",
                          "line",
                          "column"
                        ],
                        "properties": {
                          "file": {
                            "type": "string"
                          },
                          "line": {
                            "type": "integer"
                          },
                          "column": {
                            "type": "integer"
                          }
                        },
                        "additionalProperties": false
                      }
                    },
                    "additionalProperties": true
                  },
                  "definitions": {
                    "type": "array",
                    "items": {
                      "type": "object",
                      "required": [
                        "name",
                        "kind",
                        "type",
                        "hierarchical_path",
                        "lexical_path"
                      ],
                      "properties": {
                        "name": {
                          "type": "string"
                        },
                        "kind": {
                          "type": "string"
                        },
                        "type": {
                          "type": "string"
                        },
                        "direction": {
                          "type": "string"
                        },
                        "hierarchical_path": {
                          "type": "string"
                        },
                        "lexical_path": {
                          "type": "string"
                        },
                        "file": {
                          "type": "string"
                        },
                        "line": {
                          "type": "integer"
                        },
                        "column": {
                          "type": "integer"
                        },
                        "location": {
                          "type": "object",
                          "required": [
                            "file",
                            "line",
                            "column"
                          ],
                          "properties": {
                            "file": {
                              "type": "string"
                            },
                            "line": {
                              "type": "integer"
                            },
                            "column": {
                              "type": "integer"
                            }
                          },
                          "additionalProperties": false
                        }
                      },
                      "additionalProperties": true
                    }
                  },
                  "references": {
                    "type": "array",
                    "items": {
                      "type": "object",
                      "required": [
                        "access",
                        "kind",
                        "description",
                        "scope_path"
                      ],
                      "properties": {
                        "access": {
                          "type": "string",
                          "enum": [
                            "read",
                            "write",
                            "readwrite"
                          ]
                        },
                        "kind": {
                          "type": "string"
                        },
                        "description": {
                          "type": "string"
                        },
                        "scope_path": {
                          "type": "string"
                        },
                        "instance": {
                          "type": "string"
                        },
                        "port": {
                          "type": "string"
                        },
                        "direction": {
                          "type": "string"
                        },
                        "file": {
                          "type": "string"
                        },
                        "line": {
                          "type": "integer"
                        },
                        "column": {
                          "type": "integer"
                        },
                        "location": {
                          "type": "object",
                          "required": [
                            "file",
                            "line",
                            "column"
                          ],
                          "properties": {
                            "file": {
                              "type": "string"
                            },
                            "line": {
                              "type": "integer"
                            },
                            "column": {
                              "type": "integer"
                            }
                          },
                          "additionalProperties": false
                        }
                      },
                      "additionalProperties": true
                    }
                  },
                  "summary": {
                    "type": "object"
                  }
                },
                "additionalProperties": true
              }
            },
            "definitions": {
              "type": "array",
              "items": {
                "type": "object",
                "required": [
                  "kind",
                  "name"
                ],
                "properties": {
                  "kind": {
                    "type": "string",
                    "const": "module"
                  },
                  "name": {
                    "type": "string"
                  },
                  "file": {
                    "type": "string"
                  },
                  "line": {
                    "type": "integer"
                  },
                  "column": {
                    "type": "integer"
                  },
                  "location": {
                    "type": "object"
                  }
                },
                "additionalProperties": true
              }
            },
            "references": {
              "type": "array",
              "items": {
                "type": "object",
                "required": [
                  "kind",
                  "module",
                  "instance_path"
                ],
                "properties": {
                  "kind": {
                    "type": "string",
                    "enum": [
                      "instance",
                      "top_instance"
                    ]
                  },
                  "module": {
                    "type": "string"
                  },
                  "instance_path": {
                    "type": "string"
                  },
                  "file": {
                    "type": "string"
                  },
                  "line": {
                    "type": "integer"
                  },
                  "column": {
                    "type": "integer"
                  },
                  "location": {
                    "type": "object"
                  },
                  "details": {
                    "type": "object"
                  }
                },
                "additionalProperties": true
              }
            },
            "summary": {
              "type": "object"
            }
          },
          "additionalProperties": true
        },
        {
          "type": "null"
        }
      ]
    },
    "diagnostics": {
      "type": "array",
      "items": {
        "type": "object",
        "required": [
          "severity",
          "file",
          "line",
          "col",
          "message"
        ],
        "properties": {
          "severity": {
            "type": "string",
            "enum": [
              "error",
              "warning",
              "note",
              "info"
            ]
          },
          "file": {
            "type": "string"
          },
          "line": {
            "type": "integer",
            "minimum": 0
          },
          "col": {
            "type": "integer",
            "minimum": 0
          },
          "message": {
            "type": "string"
          }
        },
        "additionalProperties": false
      }
    },
    "errors": {
      "type": "array",
      "items": {
        "type": "object",
        "required": [
          "code",
          "message"
        ],
        "properties": {
          "code": {
            "type": "string",
            "enum": [
              "INPUT_NOT_FOUND",
              "BAD_FILELIST",
              "COMPILE_FAILED",
              "SCOPE_NOT_FOUND",
              "SIGNAL_NOT_FOUND",
              "BAD_CONFIG",
              "NO_TOP",
              "INTERNAL_ERROR"
            ]
          },
          "message": {
            "type": "string"
          }
        },
        "additionalProperties": false
      }
    },
    "summary": {
      "oneOf": [
        {
          "type": "object",
          "required": [
            "mode",
            "definitions",
            "references"
          ],
          "properties": {
            "mode": {
              "type": "string"
            },
            "target_kind": {
              "type": "string",
              "enum": [
                "signal",
                "module"
              ]
            },
            "symbols": {
              "type": "integer"
            },
            "definitions": {
              "type": "integer"
            },
            "references": {
              "type": "integer"
            },
            "reads": {
              "type": "integer"
            },
            "writes": {
              "type": "integer"
            },
            "port_connections": {
              "type": "integer"
            },
            "instances": {
              "type": "integer"
            }
          }
        },
        {
          "type": "null"
        }
      ]
    }
  },
  "additionalProperties": false
}
